{
  "$schema": "../../../shared/schemas/03-script.schema.json",
  "title": "임산부 정부지원금 5가지, 60일 넘기면 100만원 사라집니다 (2026.4 기준)",
  "total_duration_sec": 415,
  "language": "ko",
  "scenes": [
    {
      "id": "scene-001",
      "role": "hook",
      "headline": "60일 넘기면 100만원 사라진다",
      "narration": "출생일로부터 딱 60일. 이 기한을 하루라도 넘기면, 부모급여 100만 원이 그대로 사라집니다.",
      "subtitle_lines": [
        "출생일로부터 딱 60일.",
        "하루라도 넘기면",
        "부모급여 100만 원이",
        "그대로 사라집니다."
      ],
      "b_roll_keywords": ["달력", "X 표시", "100만원 지폐", "임산부 손"],
      "visual_intent": "달력의 60일째에 빨간 X 표시가 떠오르고, 옆의 100만원 지폐 일러스트가 사라지는 강한 임팩트.",
      "estimated_duration_sec": 7
    },
    {
      "id": "scene-002",
      "role": "intro",
      "headline": "오늘 다룰 5가지",
      "narration": "안녕하세요, 엄마지갑입니다. 오늘은 2026년 4월 27일 기준으로, 임신부터 출산 직후까지 임산부가 받을 수 있는 정부지원금 다섯 가지를, 신청 데드라인이 빠른 순서대로 정리해드릴게요. 다섯 개 모두 이름이 비슷해서 헷갈리지만, 사실 각자 신청처도, 사용 기한도, 받는 시점도 다 다릅니다. 하나라도 놓치면 받을 돈을 그냥 흘려보내게 되니까, 끝까지 같이 정리해보세요.",
      "subtitle_lines": [
        "안녕하세요, 엄마지갑입니다.",
        "오늘은 2026년 4월 27일 기준",
        "임산부가 받을 수 있는 정부지원금",
        "5가지를 데드라인 순서로 정리합니다.",
        "이름은 비슷하지만",
        "신청처·사용기한·받는 시점이",
        "전부 다릅니다.",
        "하나라도 놓치면 0원이니",
        "끝까지 같이 정리해보세요."
      ],
      "b_roll_keywords": ["채널 로고", "5가지 아이콘 정렬", "달력 타임라인"],
      "visual_intent": "채널 시그니처 컬러(연분홍·네이비)로 채널 로고 인트로 후, 5가지 제도를 가로 타임라인으로 미리 보여주기.",
      "estimated_duration_sec": 28
    },
    {
      "id": "scene-003",
      "role": "body",
      "headline": "① 국민행복카드 — 100만원",
      "narration": "첫 번째는 임신·출산 진료비 지원, 흔히 ‘국민행복카드 바우처’라고 부르는 그 100만 원입니다. 단태아 임산부는 100만 원, 쌍둥이 같은 다태아 임산부는 140만 원이 국민행복카드 포인트로 들어와요. 분만 취약지에 거주하시면 20만 원이 추가되고, 의료급여 수급자는 단태아 기준 120만 원으로 더 올라갑니다. 신청은 임신확인서를 받은 직후가 가장 좋습니다. 복지로 홈페이지에서 온라인으로 10분이면 되고, 가까운 국민건강보험공단 지사나 주민센터에서도 신청할 수 있어요. 사용 기한은 출산일로부터 2년이고, 산부인과·약국·치과 같은 요양기관에서 본인부담금 결제에 사용 가능합니다. 한 가지만 기억하세요. 카드를 받기만 하고 ‘바우처 사용 등록’을 안 하면, 잔액이 충전되지 않아 그대로 본인 돈으로 결제하게 됩니다. 카드 수령 후 카드사 앱에서 등록까지 꼭 끝내세요.",
      "subtitle_lines": [
        "① 국민행복카드",
        "임신·출산 진료비 지원",
        "단태아 100만원",
        "다태아 140만원",
        "분만취약지 +20만원",
        "의료급여 수급자 단태아 120만원",
        "신청: 임신확인서 받은 직후",
        "복지로·공단·주민센터",
        "사용기한 출산일~2년",
        "*카드 수령 후 ‘바우처 등록’ 필수",
        "안 하면 잔액 충전 안 됨"
      ],
      "b_roll_keywords": ["국민행복카드 이미지", "임신확인서 서류", "복지로 화면", "병원 결제", "쌍둥이 초음파"],
      "visual_intent": "카드 클로즈업 → 100만원 / 140만원 큰 숫자 → 복지로 신청 화면 → ‘바우처 등록’ 경고 스티커.",
      "estimated_duration_sec": 75
    },
    {
      "id": "scene-004",
      "role": "body",
      "headline": "② 첫만남이용권 — 200/300만원",
      "narration": "두 번째는 출산 직후 한 번 들어오는 첫만남이용권입니다. 첫째 아이 200만 원, 둘째 아이부터는 300만 원이 똑같이 국민행복카드 포인트로 들어와요. 쌍둥이라면 두 명 합쳐서 500만 원이 되겠죠. 사용 기한은 출생일로부터 정확히 2년입니다. 2026년 4월 1일에 태어난 아기라면, 2028년 3월 31일까지 다 써야 하고, 그 다음 날부터는 잔액이 자동으로 사라집니다. 신청은 출생신고 하러 주민센터에 갈 때, ‘행복출산 원스톱 서비스’로 한 번에 같이 처리하시는 게 가장 편합니다. 부모급여, 아동수당까지 한꺼번에 신청돼요. 그리고 한 가지 헷갈리시는 분들 많은데, 첫만남이용권은 부모급여, 아동수당과 함께 받을 수 있습니다. 셋은 서로 다른 제도라서 중복 수급이 가능합니다. 다만 부모급여와 양육수당은 같이 받을 수 없어요. 이 부분은 마지막 정리에서 다시 한 번 짚어드릴게요.",
      "subtitle_lines": [
        "② 첫만남이용권",
        "첫째 200만원 / 둘째 이상 300만원",
        "쌍둥이 = 2명 합산",
        "사용기한: 출생일~2년",
        "신청: 출생신고 시 ‘행복출산 원스톱’",
        "부모급여+아동수당과 한 번에",
        "중복 수급 가능",
        "주의: 부모급여 ↔ 양육수당은 중복 불가"
      ],
      "b_roll_keywords": ["출생신고서", "주민센터 창구", "신생아 발", "달력 2년", "원스톱 서비스 화면"],
      "visual_intent": "출생신고 → 원스톱 한 번에 → 200/300만원 카드 그래픽 → 달력 2년 만료 강조.",
      "estimated_duration_sec": 65
    },
    {
      "id": "scene-005",
      "role": "body",
      "headline": "③ 부모급여 — 60일 룰",
      "narration": "세 번째가 오늘 영상의 제목 그 부모급여입니다. 0세 아기, 그러니까 0개월부터 11개월까지는 매월 100만 원, 1세 아기는 매월 50만 원이 현금으로 들어와요. 2026년에도 전년과 같은 금액입니다. 어린이집을 다니지 않고 가정에서 양육 중이라면 매월 25일에 통장으로 그대로 입금되고, 어린이집을 이용 중이면 보육료를 뺀 차액만 다음달 20일에 들어옵니다. 0세는 차액이 41만 6천 원이고, 1세는 차액이 0원이에요. 자, 그리고 가장 중요한 부분. 부모급여는 출생일로부터 60일 안에 신청해야 출생월부터 소급해서 받을 수 있습니다. 60일을 하루라도 넘기면, 그 이전 달치는 소급되지 않고, 신청한 달부터만 지급됩니다. 0세 한 달치가 100만 원이니까, 한 달이라도 늦으면 100만 원이 그대로 사라지는 셈이에요. 신청은 행정복지센터 방문, 또는 복지로·정부24 온라인. 그리고 출생신고와 같이 행복출산 원스톱으로 한 번에 신청하는 게 가장 안전합니다.",
      "subtitle_lines": [
        "③ 부모급여",
        "0세 월 100만원 / 1세 월 50만원",
        "(2026년 전년 동일)",
        "가정양육: 매월 25일 입금",
        "어린이집 차액",
        "0세 41.6만원 / 1세 0원",
        "★ 출생일~60일 안에 신청",
        "넘기면 출생월 소급 ❌",
        "신청월부터만 지급",
        "행정복지센터 / 복지로 / 정부24"
      ],
      "b_roll_keywords": ["통장 입금 알림", "달력 60일 카운트다운", "0세/1세 아기 일러스트", "어린이집"],
      "visual_intent": "통장 입금 알림 → 25일 강조 → 달력에 60일 빨간 카운트다운 → ‘하루 늦으면 100만원 X’ 임팩트.",
      "estimated_duration_sec": 78
    },
    {
      "id": "scene-006",
      "role": "body",
      "headline": "④ 고위험 임산부 의료비 — 300만원",
      "narration": "네 번째는 모든 임산부에게 해당되지는 않지만, 해당된다면 절대 놓치면 안 되는 고위험 임산부 의료비 지원입니다. 조기진통, 임신중독증, 양막 조기파열 같은 19대 고위험 임신질환으로 입원 치료를 받으셨다면, 입원 치료비 중 본인부담금과 비급여 진료비의 90%, 1인당 최대 300만 원까지 환급받을 수 있습니다. 의료급여 수급자라면 100% 환급이고요. 2024년부터 소득 기준이 완전히 폐지되었기 때문에, 소득과 상관없이 누구나 신청 가능합니다. 가장 중요한 건 신청 기한이에요. 분만일로부터 6개월 이내에 신청해야 합니다. 출산 후 정신없는 시기라 놓치기 정말 쉬우니까, 분만 예정일 다음 달에 ‘D-180’이라고 달력에 표시해두세요. 신청은 임산부 주민등록 주소지의 보건소에 방문하거나, ‘e보건소 공공보건포털’에서 온라인으로 가능합니다. 진단서, 입퇴원 확인서, 진료비 영수증, 통장 사본 같은 서류를 미리 챙겨두시면 됩니다.",
      "subtitle_lines": [
        "④ 고위험 임산부 의료비",
        "19대 고위험 임신질환 입원치료",
        "본인부담+비급여의 90%",
        "한도 1인당 300만원",
        "의료급여 수급자 100%",
        "2024년~ 소득 기준 폐지",
        "★ 분만일~6개월 이내 신청",
        "주소지 보건소 또는 e보건소"
      ],
      "b_roll_keywords": ["병원 입원실", "진단서 서류", "보건소 외관", "e보건소 화면"],
      "visual_intent": "병원 입원실 차분한 톤 → 진단서·영수증 서류 → ‘D-180’ 카운트다운 → 보건소 / e보건소 화면.",
      "estimated_duration_sec": 70
    },
    {
      "id": "scene-007",
      "role": "body",
      "headline": "⑤ 산모·신생아 건강관리 — 산후도우미",
      "narration": "다섯 번째는 산모·신생아 건강관리 서비스, 흔히 ‘산후도우미 바우처’라고 부르는 제도입니다. 산모와 신생아의 건강을 위해 건강관리사가 일정 기간 집에 방문해서 산모 회복과 아기 돌봄을 도와줍니다. 지원 대상은 기준 중위소득 150% 이하 가구가 기본이고, 지자체별로 소득 기준을 완화해서 예외 지원하는 경우도 많습니다. 쌍둥이나 셋째 이상은 소득과 상관없이 예외 지원 대상이 되는 경우가 많아요. 지원 기간은 태아 유형, 출산 순위, 선택한 서비스 기간에 따라 5일에서 40일까지 다양하고, 지원금액도 차등 지급됩니다. 신청 기한이 두 가지 데드라인이 있어요. 빠르면 출산 예정일 40일 전부터 신청 가능하고, 늦어도 출산일로부터 60일 이내에는 신청해야 합니다. 신청은 복지로·정부24 온라인 또는 관할 보건소에서 받습니다. 자세한 본인 케이스별 지원 일수와 금액은 거주지 보건소에 직접 전화해서 확인하시는 게 가장 정확합니다.",
      "subtitle_lines": [
        "⑤ 산모·신생아 건강관리",
        "(산후도우미 바우처)",
        "기본: 기준중위소득 150% 이하",
        "쌍둥이·셋째 이상 예외 지원",
        "지원 기간 5~40일",
        "★ 출산예정 40일 전 ~ 출산 후 60일",
        "복지로 / 정부24 / 보건소"
      ],
      "b_roll_keywords": ["산모와 신생아", "건강관리사", "복지로 화면", "보건소"],
      "visual_intent": "따뜻한 베이지 톤. 산모·신생아 케어 장면 → 신청 데드라인 두 개 강조.",
      "estimated_duration_sec": 65
    },
    {
      "id": "scene-008",
      "role": "summary",
      "headline": "데드라인 캘린더 한 장",
      "narration": "정리해드릴게요. 신청 데드라인이 빠른 순서대로 다섯 개를 한 장에 정리하면 이렇게 됩니다. 임신확인 직후 — 국민행복카드 100에서 140만 원. 출산 예정일 40일 전부터 출산 후 60일 — 산모·신생아 건강관리. 출생신고와 함께 60일 안에 — 부모급여, 그리고 첫만남이용권. 분만일로부터 6개월 안에 — 고위험 임산부 의료비. 이 다섯 개가 머릿속에 그려지신다면, 오늘 영상의 핵심은 다 잡으신 겁니다. 마지막으로 제일 헷갈리는 부분 한 번만 다시. 부모급여, 아동수당, 첫만남이용권은 같이 받을 수 있고, 부모급여와 양육수당은 같이 받을 수 없습니다. 그리고 본인이 사는 시·군·구마다 추가로 출산축하금을 주는 경우가 많은데, ‘복지로’ 홈페이지에서 거주지 검색하시면 본인 지역 추가 지원금을 한 번에 보실 수 있어요.",
      "subtitle_lines": [
        "📅 신청 데드라인 캘린더",
        "임신확인 즉시 → 국민행복카드",
        "출산예정 40일 전~출산 후 60일 → 산후도우미",
        "출생신고+60일 → 부모급여·첫만남이용권",
        "분만일~6개월 → 고위험 임산부 의료비",
        "★ 부모급여+아동수당+첫만남=중복 OK",
        "★ 부모급여 ↔ 양육수당 중복 ❌",
        "거주지 추가지원: ‘복지로’ 검색"
      ],
      "b_roll_keywords": ["타임라인 인포그래픽", "체크리스트", "달력 5개 표시", "복지로 검색창"],
      "visual_intent": "한 화면에 5개 데드라인 타임라인 그래픽으로 정리. 가장 강한 비주얼 씬.",
      "estimated_duration_sec": 27
    },
    {
      "id": "scene-009",
      "role": "cta",
      "headline": "구독·다음 영상 예고",
      "narration": "오늘 영상이 도움이 되셨다면 구독과 알림설정 부탁드려요. 다음 영상에서는 출산 후 1년간 받을 수 있는 모든 지원금을, 시기별로 한 번 더 정리해드릴게요. 정책은 매년 조금씩 바뀌니까, 영상 설명란과 고정 댓글에 ‘2026년 4월 27일 기준’이라고 적어두었습니다. 그 이후에 보시는 분들은 반드시 복지로 또는 보건복지부 최신 안내를 한 번 더 확인하세요. 정보가 도움이 되셨다면 구독·알림설정 부탁드려요. 다음 영상에서 또 만나요.",
      "subtitle_lines": [
        "구독·알림설정 부탁드려요",
        "다음 영상: 출산 후 1년간 지원금",
        "정책은 매년 변경",
        "보실 때 ‘2026.4.27 기준’ 확인",
        "최신은 복지로 / 보건복지부 129"
      ],
      "b_roll_keywords": ["구독 버튼", "벨 아이콘", "다음 영상 썸네일", "채널 로고"],
      "visual_intent": "분홍 배경에 구독 버튼 강조 애니메이션, 다음 영상 썸네일 한 장 미리보기.",
      "estimated_duration_sec": 18
    }
  ],
  "qa": {
    "passed": true,
    "revision_count": 1,
    "issues": [
      {
        "scene_id": "scene-002",
        "type": "길이초과",
        "note": "초안에서 30초였으나 wpm_korean=320 기준 28초로 조정.",
        "fixed": true
      },
      {
        "scene_id": "scene-003",
        "type": "사실오류",
        "note": "초안에서 ‘카드 발급 후 자동 충전’으로 썼으나, 실제로는 ‘바우처 사용 등록’ 별도 필요. 수정 완료.",
        "fixed": true
      }
    ],
    "checklist": {
      "hook_strong": true,
      "promise_kept": true,
      "no_banned_words": true,
      "no_unverified_claims": true,
      "ends_with_cta": true
    }
  },
  "created_at": "2026-04-27T00:00:00Z"
}
